Document Date,purchasing document,item,material,short text,order quantity,order unit,currency,net price,net order value,plant,purchasing group,purchasing organization,price unit,supplier_code,supplier_name
3/15/2019,4500149960,10,,อุปกรณ์ซ่อม BSA mixing tanks (MA),1,EA,THB,"11,225.00","11,225.00",RB11,RB0,RB00,1,BG00015750," MEMBER TECH CO.,LTD."
3/15/2019,4500149960,20,,อุปกรณ์ซ่อม BSA mixing tanks (PD),1,EA,THB,"1,050.00","1,050.00",RB11,RB0,RB00,1,BG00015750," MEMBER TECH CO.,LTD."
3/21/2019,4500150080,10,,PULSARLUBE AUTO GREASE KLT1500/PL1 (IRW),1,EA,THB,"8,450.00","8,450.00",RB11,RB1,RB00,1,BG00015750," MEMBER TECH CO.,LTD."
3/21/2019,4500150080,20,,PULSARLUBE AUTO GREASE KLT1500/PL1 (IRS),1,EA,THB,"8,450.00","8,450.00",RB11,RB1,RB00,1,BG00015750," MEMBER TECH CO.,LTD."
3/21/2019,4500150081,10,,Hose loading from bulk to pump,1,JOB,THB,"14,190.00","14,190.00",RB11,RB3,RB00,1,BG00015750," MEMBER TECH CO.,LTD."
3/15/2019,4500149594,10,,งานเปลี่ยนวาล์วท่อน้ำทิ้งสุขภัณฑ์ RD-CC,1,JOB,THB,"8,711.34","8,711.34",RB11,RB0,RB00,1,BG00015912, K.Suwit Sukkasae
3/15/2019,4500149594,20,,งานเปลี่ยนวาล์วท่อน้ำทิ้งสุขภัณฑ์ PD-IRW,1,JOB,THB,"1,840.20","1,840.20",RB11,RB0,RB00,1,BG00015912, K.Suwit Sukkasae
3/15/2019,4500149594,30,,งานปลี่ยนวาล์วท่อน้ำทิ้งสุขภัณฑ์ PD-IRS,1,JOB,THB,"1,840.21","1,840.21",RB11,RB0,RB00,1,BG00015912, K.Suwit Sukkasae
3/15/2019,4500149913,10,,งานซ่อมฝาท่อปูนหน้าอาคาร WH2(IRW),1,EA,THB,"7,654.64","7,654.64",RB11,RB0,RB00,1,BG00015912, K.Suwit Sukkasae
3/15/2019,4500149913,20,,งานซ่อมฝาท่อปูนหน้าอาคาร WH2(IRS),1,EA,THB,"7,654.64","7,654.64",RB11,RB0,RB00,1,BG00015912, K.Suwit Sukkasae
3/18/2019,4500149951,10,,"ย้ายชุด Fancoil unit ขนาด19,744 BTU",1,JOB,THB,"6,750.00","6,750.00",RB11,RB2,RB00,1,BG00015913, Fresh Electric Technolog
3/18/2019,4500150189,10,,"ซ่อมเครื่องปรับอากาศ ขนาด40,722 BTU",1,SET,THB,"5,760.00","5,760.00",RB11,RB2,RB00,1,BG00015913, Fresh Electric Technolog
3/18/2019,4500150193,10,,"ซ่อมเครื่องปรับอากาศ ขนาด 80,000 BTU",1,JOB,THB,"69,700.00","69,700.00",RB11,RB1,RB00,1,BG00015913, Fresh Electric Technolog
3/18/2019,4500150194,10,,"ซ่อมเครื่องปรับอากาศ  ขนาด 28,000 BTU",1,JOB,THB,"22,500.00","22,500.00",RB11,RB2,RB00,1,BG00015913, Fresh Electric Technolog
3/4/2019,4500148342,10,,กระดานไวท์บอร์ดแม่เหล็ก 90*120 ซม.,1,SET,THB,"2,530.37","2,530.37",RB11,RB0,RB00,1,BG00016130, COL Public Company Limit
3/15/2019,4500149327,10,,โต๊ะคอมพิวเตอร์ เชอร์รี่-ดำ STB Star,1,SET,THB,"1,265.19","1,265.19",RB11,RB0,RB00,1,BG00016130, COL Public Company Limit
3/15/2019,4500149328,10,,"พัดลมติดผนัง 16"" Hatari HT-W16M6",2,SET,THB,994.39,"1,988.78",RB11,RB2,RB00,1,BG00016130, COL Public Company Limit
3/8/2019,4500148688,10,,"PROPAN-2-OL,AR 4L.(IPA) LOBA",10,EA,THB,650.00,"6,500.00",RB11,RB3,RB00,1,BG00016313," APEX CHEMICALS CO.,LTD."
3/8/2019,4500148688,20,,Toluene AR. Grade 2.5L/bot LOBA,4,EA,THB,430.00,"1,720.00",RB11,RB3,RB00,1,BG00016313," APEX CHEMICALS CO.,LTD."
3/8/2019,4500148688,30,,Aqualine Karl Fisher Complete 5,3,EA,THB,"3,700.00","11,100.00",RB11,RB3,RB00,1,BG00016313," APEX CHEMICALS CO.,LTD."
3/13/2019,4500150084,10,,Repair AC Motor 1 unit,1,JOB,THB,"6,790.00","6,790.00",RB11,RB2,RB00,1,BG00016469, Performance Industrial S
3/13/2019,4500150085,10,,Repair AC Motor Blower 1 unit,1,JOB,THB,"8,973.00","8,973.00",RB11,RB1,RB00,1,BG00016469, Performance Industrial S
3/13/2019,4500150086,10,,ค่ากำจัด Wastewater Sludge #TMS180058,"14,270.000",KG,THB,3.20,"45,664.00",RB11,RB2,RB00,1,BG00016469, Performance Industrial S
3/26/2019,4500150095,10,,Repair AC Motor 1 unit,1,JOB,THB,"18,159.00","18,159.00",RB11,RB2,RB00,1,BG00016469, Performance Industrial S
3/15/2019,4500149909,10,,PT6.35x180 mm.-H,5,EA,THB,"1,950.00","9,750.00",RB11,RB0,RB00,1,BG00016886, UNITED INSTRUMENT AND ME
3/15/2019,4500149909,20,,PFP40TSA2NG4BS,1,EA,THB,"1,800.00","1,800.00",RB11,RB0,RB00,1,BG00016886, UNITED INSTRUMENT AND ME
3/22/2019,4500150083,10,,"Vaccum Gauge LF Series Premium Dial 4""MA",1,JOB,THB,"10,800.00","10,800.00",RB11,RB0,RB00,1,BG00016886, UNITED INSTRUMENT AND ME
3/22/2019,4500150083,20,,"Vaccum Gauge LF Series Premium Dial 4""PD",1,JOB,THB,"5,400.00","5,400.00",RB11,RB0,RB00,1,BG00016886, UNITED INSTRUMENT AND ME
3/14/2019,4500149201,10,,"Tetrahydrofuran ,AR grade 2.5L (Fisher)",50,EA,THB,"1,300.00","65,000.00",RB11,RB1,RB00,1,BG00018301, S.M. CHEMICAL SUPPLIES C
3/15/2019,4500149886,10,,VALBIA ACTUATOR DOUBLE ACTING ONLY,1,PC,THB,"4,112.00","4,112.00",RB11,RB0,RB00,1,BG00018406, T.A.B Engineering and Su
3/15/2019,4500149886,20,,VALBIA ACTUATOR DOUBLE ACTING ONLY,1,PC,THB,"5,200.00","5,200.00",RB11,RB0,RB00,1,BG00018406, T.A.B Engineering and Su
3/6/2019,4500149197,10,,"""KITZ"" 2PC Ball Valve Model:10 UTB(MA)",1,EA,THB,"13,800.00","13,800.00",RB11,RB0,RB00,1,BG00018771," PAKO ENGINEERING CO.,LTD"
3/6/2019,4500149197,20,,"""KITZ"" 2PC Ball Valve Model:10 UTB(PD)",1,EA,THB,"13,800.00","13,800.00",RB11,RB0,RB00,1,BG00018771," PAKO ENGINEERING CO.,LTD"
3/21/2019,4500149958,10,,"""KITZ"" Y-Strainer Model UYB",1,EA,THB,"12,300.00","12,300.00",RB11,RB3,RB00,1,BG00018771," PAKO ENGINEERING CO.,LTD"
3/21/2019,4500149958,20,,"""WELL"" Wafer Disc Check Valve",1,EA,THB,"2,100.00","2,100.00",RB11,RB3,RB00,1,BG00018771," PAKO ENGINEERING CO.,LTD"
3/21/2019,4500149959,10,,"""KITZ"" 2-PC Ball Valve Model:10UTB",2,EA,THB,"5,900.00","11,800.00",RB11,RB3,RB00,1,BG00018771," PAKO ENGINEERING CO.,LTD"
3/21/2019,4500149959,20,,"""KITZ"" 1-PC Ball Valve Model:UTKM",1,EA,THB,510.00,510.00,RB11,RB3,RB00,1,BG00018771," PAKO ENGINEERING CO.,LTD"
3/21/2019,4500149959,30,,"""KITZ"" Gate Valve Model:UEB SS304",1,EA,THB,"10,100.00","10,100.00",RB11,RB3,RB00,1,BG00018771," PAKO ENGINEERING CO.,LTD"
3/21/2019,4500149959,40,,"หน้าแปลนเชื่อมสแตนเลส 304 PN16  2""",2,EA,THB,570.00,"1,140.00",RB11,RB3,RB00,1,BG00018771," PAKO ENGINEERING CO.,LTD"
3/21/2019,4500149952,10,,Pressure Transmitters PW Tank,1,JOB,THB,"22,500.00","22,500.00",RB11,RB2,RB00,1,BG00019730," CI TRANSFER CO.,LTD."
3/21/2019,4500150026,10,,Improvement WTP,1,EA,THB,"35,700.00","35,700.00",RB11,RB0,RB00,1,BG00020085," CI Transfer Co.,Ltd."
3/6/2019,4500149319,10,,Fire Protection System,1,EA,THB,"6,000.00","6,000.00",RB11,RB3,RB00,1,BG00020880, HARN ENGINEERING SOLUTIO
3/6/2019,4500149324,10,,Repair engine gasket and exhanst dust,1,EA,THB,"120,000.00","120,000.00",RB11,RB0,RB00,1,BG00020880, HARN ENGINEERING SOLUTIO
3/1/2019,4500148169,10,,"Calibration O2,LEL,CO,H2S sensor for MX6",2,JOB,THB,"2,800.00","5,600.00",RB11,RB0,RB00,1,BG00022374, DETECTION SAFE ENGINEERI
3/1/2019,4500148169,20,,Calibration VOC sensor for MX6,2,JOB,THB,"2,500.00","5,000.00",RB11,RB0,RB00,1,BG00022374, DETECTION SAFE ENGINEERI
3/1/2019,4500148169,30,,"Calibration O2,LEL,CO,H2S sensor for MX4",2,JOB,THB,"2,800.00","5,600.00",RB11,RB0,RB00,1,BG00022374, DETECTION SAFE ENGINEERI
3/1/2019,4500148169,40,,Travelling charge,2,JOB,THB,"1,000.00","2,000.00",RB11,RB0,RB00,1,BG00022374, DETECTION SAFE ENGINEERI
3/29/2019,4500150431,10,,Oxygen sensor for MX4,1,EA,THB,"9,500.00","9,500.00",RB11,RB0,RB00,1,BG00022374, DETECTION SAFE ENGINEERI
3/29/2019,4500150431,20,,Travelling Charge,1,EA,THB,"1,000.00","1,000.00",RB11,RB0,RB00,1,BG00022374, DETECTION SAFE ENGINEERI
3/4/2019,4500148296,10,,Blank Label PP matte White,"40,000",EA,THB,2.86,"114,400.00",RB11,RB1,RB00,1,BG00022618," Weltron Corporation Co.,"
3/29/2019,4500150389,10,,Blank Label : paper งานใสรูเตย,"10,000",EA,THB,4.00,"40,000.00",RB11,RB1,RB00,1,BG00022618," Weltron Corporation Co.,"
3/12/2019,4500148968,10,,Calibration Boiler for Gas testo 340,1,JOB,THB,"11,300.00","11,300.00",RB11,RB0,RB00,1,BG00022941," ENTECH ASSOCIATION CO.,L"
3/15/2019,4500149241,10,,Rental Plastic Pallet: SANKO JP(5 years),5,EA,THB,"175,200.00","876,000.00",RB11,RB3,RB00,1,BG00023213, SANKO PALLET RENTAL (THA
3/8/2019,4500148782,10,,Addition cost for change flow meter to,1,SET,THB,"74,000.00","74,000.00",RB11,RB2,RB00,1,BG00023651," CRONOS SERVICES CO.,LTD."
3/27/2019,4500150197,10,,Additional Instrument 30%,1,EA,THB,"35,023.20","35,023.20",RB11,RB1,RB00,1,BG00023651," CRONOS SERVICES CO.,LTD."
3/27/2019,4500150197,20,,Additional Instrument 70%,1,EA,THB,"81,720.80","81,720.80",RB11,RB1,RB00,1,BG00023651," CRONOS SERVICES CO.,LTD."
3/12/2019,4500148913,10,,"Printer""Epson"" M200 Mono all-in one ink",1,SET,THB,"5,800.00","5,800.00",RB11,RB0,RB00,1,BG00023884, Comp Tech Integration Se
3/27/2019,4500150198,10,,Initial Assessment Stage 1 OHSAS18001,1,JOB,THB,"30,000.00","30,000.00",RB11,RB0,RB00,1,BG00024491," BSI GROUP(THAILAND) CO.,"
3/27/2019,4500150198,20,,Travelling,1,JOB,THB,"1,700.00","1,700.00",RB11,RB0,RB00,1,BG00024491," BSI GROUP(THAILAND) CO.,"
3/6/2019,4500148553,10,,งานปรับปรุงสาย Lan ป้อม รปภ.1,1,JOB,THB,"12,000.00","12,000.00",RB11,RB0,RB00,1,BG00024692, DAS INTERNET SOLUTIONS C
3/7/2019,4500149604,10,,แผ่นเพลสฉลุพ่นตัวเลข,4,EA,THB,800.00,"3,200.00",RB11,RB1,RB00,1,BG00024777, Mr.Tongchai Srisakul
3/7/2019,4500149604,20,,แผ่นเพลสฉลุตัวเลข+อักษร,2,EA,THB,"1,000.00","2,000.00",RB11,RB1,RB00,1,BG00024777, Mr.Tongchai Srisakul
3/7/2019,4500149604,30,,แผ่นเพลสฉลุตัวเลข,5,EA,THB,400.00,"2,000.00",RB11,RB1,RB00,1,BG00024777, Mr.Tongchai Srisakul
3/7/2019,4500149604,40,,แผ่นเพลสฉลุภาษาอังกฤษ,3,EA,THB,"1,040.00","3,120.00",RB11,RB1,RB00,1,BG00024777, Mr.Tongchai Srisakul
3/1/2019,4500148961,10,,"Notebook""Panasonic""CF-SZ6B57VS",1,SET,THB,"55,750.00","55,750.00",RB11,RB2,RB00,1,HRBTJ009  , MR.DAISUKE  HASEGAWA
