Document Date,purchasing document,item,material,short text,order quantity,order unit,currency,net price,net order value,plant,purchasing group,purchasing organization,price unit,supplier_code,supplier_name
3/13/2019,4500149122,10,,สีน้ำเงิน,20.000,KG,THB,350.00,"7,000.00",RB11,RB3,RB00,1,BG00012081, KLIMCO LIMITED
3/13/2019,4500149122,20,,สีเหลือง,20.000,KG,THB,430.00,"8,600.00",RB11,RB3,RB00,1,BG00012081, KLIMCO LIMITED
3/4/2019,4500148341,10,,HDD 4TB WD,1,SET,THB,"8,500.00","8,500.00",RB11,RB1,RB00,1,BG00012093, S.P. TECHNOLOGY AND COMM
3/8/2019,4500149176,10,,Repair Indicator for Scale 5 tons,1,EA,THB,"15,000.00","15,000.00",RB11,RB1,RB00,1,BG00012100, CHANWATTANA  SCALE SALE
3/19/2019,4500149486,10,,Calibration Truck Scale 6 Ton.,1,EA,THB,"25,000.00","25,000.00",RB11,RB1,RB00,1,BG00012100, CHANWATTANA  SCALE SALE
3/18/2019,4500149350,10,,Indicator for 60 kgs. Model: IDS711,1,SET,THB,"28,500.00","28,500.00",RB11,RB1,RB00,1,BG00012101, CHANWATTANA  SCALE SALE
3/11/2019,4500148789,10,,"เครื่องดับเพลิง""Anti-Fire""ชนิดผงเคมีแห้ง",5,SET,THB,"1,380.00","6,900.00",RB11,RB0,RB00,1,BG00012103," ANTI FIRE INDUSTRY CO.,"
3/8/2019,4500148739,10,,Hydrostatic Testเครื่องถังดับเพลิงชนิดผง,22,EA,THB,490.00,"10,780.00",RB11,RB0,RB00,1,BG00012104," ANTI FIRE INDUSTRY CO.,"
3/8/2019,4500148739,20,,เติมน้ำยาถังดับเพลิงชนิดผงเคมีแห้ง,22,EA,THB,450.00,"9,900.00",RB11,RB0,RB00,1,BG00012104," ANTI FIRE INDUSTRY CO.,"
3/6/2019,4500148456,10,,ต่ออายุสมาชิก 2 ปี,0,JOB,THB,0.00,0.00,RB11,RB0,RB00,1,BG00012129," DHARMNITI PRESS CO., LTD"
3/6/2019,4500148463,10,,ประกันรถยนต์,1,JOB,THB,"20,670.08","20,670.08",RB11,RB0,RB00,1,BG00012168, MITSUI SUMITOMO INSURANC
3/6/2019,4500148463,20,,พรบ.รถยนต์,1,JOB,THB,573.21,573.21,RB11,RB0,RB00,1,BG00012168, MITSUI SUMITOMO INSURANC
3/6/2019,4500148544,10,,พรบ.รถยนต์,1,JOB,THB,573.21,573.21,RB11,RB0,RB00,1,BG00012168, MITSUI SUMITOMO INSURANC
3/7/2019,4500148645,10,,Travelling insurance,1,JOB,THB,"13,483.58","13,483.58",RB11,RB1,RB00,1,BG00012168, MITSUI SUMITOMO INSURANC
3/6/2019,4500148458,10,,ต่ออายุสมาชิก,1,JOB,THB,"2,803.74","2,803.74",RB11,RB0,RB00,1,BG00012217, TECHNOLOGY PROMOTION ASS
3/11/2019,4500148773,10,,ค่าโฆษณารับสมัครงาน,2,EA,THB,"9,504.00","19,008.00",RB11,RB0,RB00,1,BG00012227," THINKNET CO., LTD."
3/1/2019,4500148974,10,,ค่าบำรุงรักษาปั้นจั่นชนิดอยู่กับที RD-CC,1,JOB,THB,"2,800.00","2,800.00",RB11,RB0,RB00,1,BG00012325, ALLA PUBLIC COMPANY LIMI
3/1/2019,4500148974,20,,ค่าบำรุงรักษาปั้นจั่นชนิดอยู่กับทีPD-IRS,1,JOB,THB,"8,400.00","8,400.00",RB11,RB0,RB00,1,BG00012325, ALLA PUBLIC COMPANY LIMI
3/11/2019,4500149884,10,,เปลี่ยนสลิง Hoist GL-06,38,EA,THB,255.00,"9,690.00",RB11,RB2,RB00,1,BG00012325, ALLA PUBLIC COMPANY LIMI
3/11/2019,4500149884,20,,Tension Spring SH40,1,EA,THB,"2,125.00","2,125.00",RB11,RB2,RB00,1,BG00012325, ALLA PUBLIC COMPANY LIMI
3/11/2019,4500149884,30,,Service charge for replae spare part,1,JOB,THB,"2,975.00","2,975.00",RB11,RB2,RB00,1,BG00012325, ALLA PUBLIC COMPANY LIMI
3/18/2019,4500149405,10,,Bulk Strap Model: BS65,3,EA,THB,"5,600.00","16,800.00",RB11,RB1,RB00,1,BG00012348," ATMET PACKAGING CO., LTD"
3/18/2019,4500149405,20,,Buckles Model: BB6 (For BS65),2,EA,THB,"2,800.00","5,600.00",RB11,RB1,RB00,1,BG00012348," ATMET PACKAGING CO., LTD"
3/21/2019,4500150199,10,,HD-BPS210 DOPCIII Battery backup module,1,SET,THB,"25,300.00","25,300.00",RB11,RB1,RB00,1,BG00012350," AZBIL (THAILAND) CO., LT"
3/21/2019,4500150199,20,,HD-BPS210 DOPCIII Battery backup module,1,SET,THB,"25,300.00","25,300.00",RB11,RB1,RB00,1,BG00012350," AZBIL (THAILAND) CO., LT"
3/21/2019,4500150071,10,,DOPCIII Battery Backup Module (IRW),1,EA,THB,"25,300.00","25,300.00",RB11,RB2,RB00,1,BG00012351," AZBIL (THAILAND) CO., LT"
3/21/2019,4500150071,20,,DOPCIII Battery Backup Module (IRS),1,EA,THB,"25,300.00","25,300.00",RB11,RB2,RB00,1,BG00012351," AZBIL (THAILAND) CO., LT"
3/19/2019,4500149956,10,,กำจัด Commercial Waste,"2,080.000",KG,THB,2.80,"5,824.00",RB11,RB0,RB00,1,BG00012356, BANGPOO ENVIRONMENTAL CO
3/19/2019,4500149956,20,,Collection Fee,1,EA,THB,"4,250.00","4,250.00",RB11,RB0,RB00,1,BG00012356, BANGPOO ENVIRONMENTAL CO
3/19/2019,4500149957,10,,กำจัด Commercial Waste,"2,660.000",KG,THB,2.80,"7,448.00",RB11,RB0,RB00,1,BG00012356, BANGPOO ENVIRONMENTAL CO
3/19/2019,4500149957,20,,Collection Fee,1,JOB,THB,"4,250.00","4,250.00",RB11,RB0,RB00,1,BG00012356, BANGPOO ENVIRONMENTAL CO
3/20/2019,4500150357,10,,"ฟอร์ม Truck Load 9""x11"" 3P 1C 500ชุด/box","10,000",EA,THB,1.50,"15,000.00",RB11,RB1,RB00,1,BG00012362," BEST FORM PRINT CO., LTD"
3/29/2019,4500150436,10,,"ใบกำกับภาษี ขนาด9""x1"" 6P 1C","10,000",EA,THB,2.80,"28,000.00",RB11,RB1,RB00,1,BG00012362," BEST FORM PRINT CO., LTD"
3/29/2019,4500150440,10,,"ใบกำกับภาษี ขนาด9""x1"" 6P 1C (UU)","3,500",EA,THB,2.80,"9,800.00",RB11,RB3,RB00,1,BG00012362," BEST FORM PRINT CO., LTD"
3/29/2019,4500150440,20,,"ใบกำกับภาษี ขนาด9""x1"" 6P 1C (IRW)","1,000",EA,THB,2.80,"2,800.00",RB11,RB3,RB00,1,BG00012362," BEST FORM PRINT CO., LTD"
3/29/2019,4500150440,30,,"ใบกำกับภาษี ขนาด9""x1"" 6P 1C (IRS)","1,000",EA,THB,2.80,"2,800.00",RB11,RB3,RB00,1,BG00012362," BEST FORM PRINT CO., LTD"
3/20/2019,4500149564,10,,ค่ากำจัดแลบำบัด Contaminated packagaging,"3,230.000",KG,THB,2.70,"8,721.00",RB11,RB0,RB00,1,BG00012366, BETTER WORLD GREEN PUBLI
3/20/2019,4500149564,20,,ค่าขนส่ง,1,EA,THB,"6,000.00","6,000.00",RB11,RB0,RB00,1,BG00012366, BETTER WORLD GREEN PUBLI
3/19/2019,4500149583,10,,ค่าบริการกำจัดและบำบัดเรซิ่นเสื่อมสภาพ,"5,390.000",KG,THB,2.80,"15,092.00",RB11,RB2,RB00,1,BG00012366, BETTER WORLD GREEN PUBLI
3/19/2019,4500149583,20,,ค่าขนส่ง,1.000,KG,THB,"5,000.00","5,000.00",RB11,RB2,RB00,1,BG00012366, BETTER WORLD GREEN PUBLI
3/28/2019,4500150356,10,,,0.000,KG,THB,0.00,0.00,RB11,RB1,RB00,1,BG00012373, BRENNTAG INGREDIENTS (TH
3/19/2019,4500149490,10,,calibration for PM-QUV/SE,3,EA,THB,"11,100.00","33,300.00",RB11,RB1,RB00,1,BG00012397," COLOR GLOBAL CO., LTD."
3/1/2019,4500149296,10,,"Overhaul ""Tuthill"" Internal Gear Pump",1,EA,THB,"15,500.00","15,500.00",RB11,RB3,RB00,1,BG00012452, FLUID ADVANCE (THAILAND)
3/1/2019,4500149296,20,,"Overhaul ""Tuthill"" NORD"" Gear reducer",1,EA,THB,"2,500.00","2,500.00",RB11,RB3,RB00,1,BG00012452, FLUID ADVANCE (THAILAND)
3/1/2019,4500149296,30,,Service charge and Transportation,1,EA,THB,"5,500.00","5,500.00",RB11,RB3,RB00,1,BG00012452, FLUID ADVANCE (THAILAND)
3/1/2019,4500149307,10,,"Additional repair work Overhaul""Tuthill""",1,EA,THB,"20,000.00","20,000.00",RB11,RB3,RB00,1,BG00012452, FLUID ADVANCE (THAILAND)
3/1/2019,4500149307,20,,"Overhaul ""Tuthill"" NORD"" Gear reducer",1,EA,THB,"3,300.00","3,300.00",RB11,RB3,RB00,1,BG00012452, FLUID ADVANCE (THAILAND)
3/1/2019,4500149308,10,,"Overhaul ""SIHI"" Vacuum pump",1,EA,THB,"58,900.00","58,900.00",RB11,RB1,RB00,1,BG00012452, FLUID ADVANCE (THAILAND)
3/21/2019,4500149950,10,,Gasket V#N7031-S5HZAH(OD)780x(ID)690x4.0,1,SET,THB,"16,500.00","16,500.00",RB11,RB2,RB00,1,BG00012462," GEWINN ENGINEERING CO.,"
3/21/2019,4500150067,10,,"งานเปลี่ยนปะเก็น 6""(ตั้งนั่งร้านแขวนลอก)",1,JOB,THB,"26,600.00","26,600.00",RB11,RB0,RB00,1,BG00012462," GEWINN ENGINEERING CO.,"
3/21/2019,4500150070,10,,"งานหุ้มฉนวนท่อ 6"" (UT-IRW)",1,JOB,THB,"11,700.00","11,700.00",RB11,RB2,RB00,1,BG00012462," GEWINN ENGINEERING CO.,"
3/21/2019,4500150070,20,,"งานหุ้มฉนวนท่อ 6"" (UT-IRS)",1,JOB,THB,"11,700.00","11,700.00",RB11,RB2,RB00,1,BG00012462," GEWINN ENGINEERING CO.,"
3/21/2019,4500150072,10,,Repair leakage on jacket,1,JOB,THB,"33,000.00","33,000.00",RB11,RB3,RB00,1,BG00012462," GEWINN ENGINEERING CO.,"
3/21/2019,4500150074,10,,"งานถอดทำความสะอาดท่อ 10"" DC-211",1,JOB,THB,"53,500.00","53,500.00",RB11,RB2,RB00,1,BG00012462," GEWINN ENGINEERING CO.,"
3/21/2019,4500150076,10,,งานเปลี่ยนท่อน้ำ Cooling  อุปกรณ์ 11item,1,JOB,THB,"73,980.00","73,980.00",RB11,RB2,RB00,1,BG00012462," GEWINN ENGINEERING CO.,"
3/29/2019,4500150442,10,,Wastewater analysis work,1,JOB,THB,"9,500.00","9,500.00",RB11,RB0,RB00,1,BG00012469," GOSHU TECHNOSERVICE CO.,"
3/6/2019,4500148550,10,,Plastic bottle  500 cc.(29 g.),"2,000",EA,THB,6.90,"13,800.00",RB11,RB1,RB00,1,BG00012481," HOONG HUAT PLASTIC LTD.,"
3/18/2019,4500149394,10,,ขวดพลาสติก 500 cc. ใส,"2,000",EA,THB,6.90,"13,800.00",RB11,RB1,RB00,1,BG00012481," HOONG HUAT PLASTIC LTD.,"
3/6/2019,4500149313,10,,Shell Omala S2 GX 150/D209L,1,EA,THB,"19,300.00","19,300.00",RB11,RB0,RB00,1,BG00012484," IIDA-SEVEN SUN CO., LTD."
3/6/2019,4500149313,20,,Shell Omala S2 GX 220/D209L,1,EA,THB,"19,300.00","19,300.00",RB11,RB0,RB00,1,BG00012484," IIDA-SEVEN SUN CO., LTD."
3/12/2019,4500148927,10,,ถุงมือผ้า (โหล),50,EA,THB,70.00,"3,500.00",RB11,RB0,RB00,1,BG00012500, J & S SAFETY SUPPLY LTD.
3/12/2019,4500148927,20,,ตลับกรองหน้ากากครึ่งหน้า 3M.7007K-100,30,EA,THB,150.00,"4,500.00",RB11,RB0,RB00,1,BG00012500, J & S SAFETY SUPPLY LTD.
3/12/2019,4500148927,30,,ถุงมือยางดำ Tiger 24นิ้ว (คู่),8,EA,THB,180.00,"1,440.00",RB11,RB0,RB00,1,BG00012500, J & S SAFETY SUPPLY LTD.
3/12/2019,4500148927,40,,แผ่นกรองฝุ่น 3M-7711,40,EA,THB,36.00,"1,440.00",RB11,RB0,RB00,1,BG00012500, J & S SAFETY SUPPLY LTD.
3/12/2019,4500148927,50,,ฝาครอบ 3M 774,30,EA,THB,53.00,"1,590.00",RB11,RB0,RB00,1,BG00012500, J & S SAFETY SUPPLY LTD.
3/12/2019,4500148927,60,,หน้ากากครึ่งหน้า 3M 7702,8,EA,THB,590.00,"4,720.00",RB11,RB0,RB00,1,BG00012500, J & S SAFETY SUPPLY LTD.
3/11/2019,4500148851,10,,รถเข็นถาดเหล็ก 3 ชั้น Model: TT3-5007,1,SET,THB,"4,675.00","4,675.00",RB11,RB2,RB00,1,BG00012504," JENBUNJERD CO., LTD."
3/26/2019,4500150087,10,,ค่ากำจัด Wastewater Sludge #TMS180058,"14,270.000",KG,THB,3.20,"45,664.00",RB11,RB1,RB00,1,BG00012511," K.S. WASTE RECOVERY CO.,"
3/26/2019,4500150088,10,,ค่ากำจัดน้ำเสียจากการดักจับไอระเหย lot 1,"29,610.000",KG,THB,4.80,"142,128.00",RB11,RB2,RB00,1,BG00012511," K.S. WASTE RECOVERY CO.,"
3/26/2019,4500150088,20,,ค่ากำจัดน้ำเสียจากการดักจับไอระเหย lot 2,"27,510.000",KG,THB,4.80,"132,048.00",RB11,RB2,RB00,1,BG00012511," K.S. WASTE RECOVERY CO.,"
3/26/2019,4500150088,30,,ค่ากำจัดน้ำเสียจากการดักจับไอระเหย lot 3,"29,740.000",KG,THB,4.80,"142,752.00",RB11,RB2,RB00,1,BG00012511," K.S. WASTE RECOVERY CO.,"
3/26/2019,4500150088,40,,ค่ากำจัดน้ำเสียจากการดักจับไอระเหย lot 4,"29,440.000",KG,THB,4.80,"141,312.00",RB11,RB2,RB00,1,BG00012511," K.S. WASTE RECOVERY CO.,"
3/26/2019,4500150088,50,,ค่ากำจัดน้ำเสียจากการดักจับไอระเหย lot 5,"26,810.000",KG,THB,4.80,"128,688.00",RB11,RB2,RB00,1,BG00012511," K.S. WASTE RECOVERY CO.,"
3/26/2019,4500150092,10,,ค่าบริการล้างทำความสะอาด Drum,"2,175",EA,THB,3.00,"6,525.00",RB11,RB1,RB00,1,BG00012511," K.S. WASTE RECOVERY CO.,"
3/26/2019,4500150092,20,,ค่าบริการล้างทำความสะอาด Drum คุมเครื่อง,"2,175",EA,THB,5.00,"10,875.00",RB11,RB1,RB00,1,BG00012511," K.S. WASTE RECOVERY CO.,"
3/26/2019,4500150092,30,,ค่าบริการล้างทำความสะอาด Bulk,540,EA,THB,60.00,"32,400.00",RB11,RB1,RB00,1,BG00012511," K.S. WASTE RECOVERY CO.,"
3/26/2019,4500150092,40,,ค่าบริการทำความสะอาด Bulk (B),3,EA,THB,100.00,300.00,RB11,RB1,RB00,1,BG00012511," K.S. WASTE RECOVERY CO.,"
3/12/2019,4500148909,10,,Set A:Clamp-on flow sensor,1,SET,THB,"34,000.00","34,000.00",RB11,RB2,RB00,1,BG00012516," KEYENCE (THAILAND) CO.,"
3/18/2019,4500149403,10,,Patition Sheet 1.2 x1.2 ม.,600,EA,THB,43.00,"25,800.00",RB11,RB1,RB00,1,BG00012525," L.Y. COMMERCIAL CO., LTD"
3/11/2019,4500148871,10,,Pegboard drying rack(45x63 cm.),1,EA,THB,"3,900.00","3,900.00",RB11,RB1,RB00,1,BG00012527, LAB VALLEY LIMITED PARTN
3/11/2019,4500148871,20,,ถุงมือแพทย์ชนิดไม่มีแป้งSize M(box),36,EA,THB,190.00,"6,840.00",RB11,RB1,RB00,1,BG00012527, LAB VALLEY LIMITED PARTN
3/11/2019,4500148871,30,,ถุงมือแพทย์ชนิดไม่มีแป้งSize L(box),36,EA,THB,190.00,"6,840.00",RB11,RB1,RB00,1,BG00012527, LAB VALLEY LIMITED PARTN
3/11/2019,4500148871,40,,Thermometer 0-50 C Alcohol (สีแดง) box,10,EA,THB,95.00,950.00,RB11,RB1,RB00,1,BG00012527, LAB VALLEY LIMITED PARTN
3/22/2019,4500150156,10,,Helium gas (UHP),1,EA,THB,"11,686.50","11,686.50",RB11,RB1,RB00,1,BG00012538, LINDE(THAILAND)PUBLIC CO
3/22/2019,4500150156,20,,Delivery Charges Helium,1,EA,THB,40.00,40.00,RB11,RB1,RB00,1,BG00012538, LINDE(THAILAND)PUBLIC CO
3/22/2019,4500150156,30,,Nitrogen gas (UHP),2,EA,THB,801.00,"1,602.00",RB11,RB1,RB00,1,BG00012538, LINDE(THAILAND)PUBLIC CO
3/22/2019,4500150156,40,,Delivery Charges Nitrogen,2,EA,THB,60.00,120.00,RB11,RB1,RB00,1,BG00012538, LINDE(THAILAND)PUBLIC CO
3/4/2019,4500148215,10,,คูปองน้ำดื่ม,720,EA,THB,33.00,"23,760.00",RB11,RB0,RB00,1,BG00012547, M. WATER
3/29/2019,4500150370,10,,คูปองน้ำดื่ม,720,EA,THB,33.00,"23,760.00",RB11,RB0,RB00,1,BG00012547, M. WATER
3/8/2019,4500148738,10,,ธงญี่ปุ่น 50x116cm. มอง2 ด้านพร้อมติดตัง,3,EA,THB,500.00,"1,500.00",RB11,RB0,RB00,1,BG00012552, MAK ADVERTISING
3/8/2019,4500148738,20,,แผ่นอลูมิเนียมหนา 1 mm.,16,EA,THB,550.00,"8,800.00",RB11,RB0,RB00,1,BG00012552, MAK ADVERTISING
3/8/2019,4500148738,30,,แผ่นอลูมิเนียมหนา 1 mm.,3,EA,THB,800.00,"2,400.00",RB11,RB0,RB00,1,BG00012552, MAK ADVERTISING
3/20/2019,4500149828,10,,"พัดลมระบายอากาศ""Panasonic""#FV-20RLT2",1,SET,THB,"1,150.00","1,150.00",RB11,RB1,RB00,1,BG00012559," Member Tech CO., LTD."
3/12/2019,4500148971,10,,ซ่อมเครื่อง Auto titrate,1,JOB,THB,"16,335.00","16,335.00",RB11,RB1,RB00,1,BG00012564, METROHM SIAM LTD.
3/12/2019,4500148971,20,,Electrode Cable Plug F 1m,1,EA,THB,"3,330.00","3,330.00",RB11,RB1,RB00,1,BG00012564, METROHM SIAM LTD.
3/4/2019,4500148288,10,,INLAB ROUTINE PRO-ISM,1,PC,THB,"13,600.00","13,600.00",RB11,RB1,RB00,1,BG00012567, METTLER-TOLEDO (THAILAND
3/4/2019,4500148288,20,,INLAB Cable Multipin-BNC/RCA1,1,PC,THB,"4,845.00","4,845.00",RB11,RB1,RB00,1,BG00012567, METTLER-TOLEDO (THAILAND
3/4/2019,4500148234,10,,กระดาษเช็ดมือ Scott,5,EA,THB,"1,130.00","5,650.00",RB11,RB0,RB00,1,BG00012595," NPK MASTERPLAN CO., LTD."
3/4/2019,4500148234,20,,ถุงขยะ 30*40,25.000,KG,THB,39.00,975.00,RB11,RB0,RB00,1,BG00012595," NPK MASTERPLAN CO., LTD."
3/4/2019,4500148234,30,,ถุงขยะ 36*45,25.000,KG,THB,39.00,975.00,RB11,RB0,RB00,1,BG00012595," NPK MASTERPLAN CO., LTD."
3/4/2019,4500148234,40,,สบู่เหลวล้างมือ 3M ชมพู,4,EA,THB,120.00,480.00,RB11,RB0,RB00,1,BG00012595," NPK MASTERPLAN CO., LTD."
3/4/2019,4500148234,50,,กระดาษเช็ดมือ Festa,5,EA,THB,900.00,"4,500.00",RB11,RB0,RB00,1,BG00012595," NPK MASTERPLAN CO., LTD."
3/28/2019,4500150350,10,,โอวัลตินชนิดเติม 1000 กรัม,1,EA,THB,"1,680.00","1,680.00",RB11,RB0,RB00,1,BG00012595," NPK MASTERPLAN CO., LTD."
3/28/2019,4500150350,20,,น้ำตาลทรายขาวมิตรผล,12,EA,THB,24.50,294.00,RB11,RB0,RB00,1,BG00012595," NPK MASTERPLAN CO., LTD."
3/28/2019,4500150350,30,,กระดาษชำระ Kimsoft jumbo roll,3,EA,THB,640.00,"1,920.00",RB11,RB0,RB00,1,BG00012595," NPK MASTERPLAN CO., LTD."
3/28/2019,4500150350,40,,กระดาษเช็ดมือ Festa,8,EA,THB,900.00,"7,200.00",RB11,RB0,RB00,1,BG00012595," NPK MASTERPLAN CO., LTD."
3/28/2019,4500150350,50,,สบู่เหลวล้างมือ 3M ชมพู,4,EA,THB,120.00,480.00,RB11,RB0,RB00,1,BG00012595," NPK MASTERPLAN CO., LTD."
3/28/2019,4500150350,60,,ถุงขยะ 30*40,25,EA,THB,39.00,975.00,RB11,RB0,RB00,1,BG00012595," NPK MASTERPLAN CO., LTD."
3/28/2019,4500150350,70,,ถุงขยะ 24*28,25,EA,THB,39.00,975.00,RB11,RB0,RB00,1,BG00012595," NPK MASTERPLAN CO., LTD."
3/1/2019,4500148784,10,,งานทำ Slop กันสาดชั้น 2 แผนก RD,1,JOB,THB,"5,500.00","5,500.00",RB11,RB0,RB00,1,BG00012643, PHUMIWISE MECHANICALS AN
3/1/2019,4500148786,10,,ซ่อมแซมเสาที่ชำรุด  Modification work,1,JOB,THB,"26,500.00","26,500.00",RB11,RB1,RB00,1,BG00012643, PHUMIWISE MECHANICALS AN
3/21/2019,4500149953,10,,อุปกรณ์หุ้มขาเสาถัง K ที่ PD-2,1,JOB,THB,"29,950.00","29,950.00",RB11,RB1,RB00,1,BG00012643, PHUMIWISE MECHANICALS AN
3/21/2019,4500149954,10,,ซ่อมแซมขาเสาถัง K ที่ PD-2,1,JOB,THB,"16,500.00","16,500.00",RB11,RB1,RB00,1,BG00012643, PHUMIWISE MECHANICALS AN
3/15/2019,4500149500,10,,INVERTER ABB : ACS580-01-088A-4+J400,1,EA,THB,"100,000.00","100,000.00",RB11,RB1,RB00,1,BG00012653, POKIN ENGINEERING AND DE
3/12/2019,4500148967,10,,ซ่อม Hydraulic drum คันที่ 1/3,1,JOB,THB,"9,711.00","9,711.00",RB11,RB3,RB00,1,BG00012664, PREMIUM PRODUCTS INDUSTR
3/29/2019,4500150443,10,,ซ่อม Hydraulic drum คันที่ 2/3,1,JOB,THB,"9,405.00","9,405.00",RB11,RB3,RB00,1,BG00012664, PREMIUM PRODUCTS INDUSTR
3/28/2019,4500150392,10,,Sticker Prominate BMST-610CT,"5,000",EA,THB,4.00,"20,000.00",RB11,RB2,RB00,1,BG00012690, S.RUNGCHAI PUBLISHING  C
3/6/2019,4500148570,10,,ซ่อมเครื่อง Viscometer รุ่น LVDV-E,1,EA,THB,"7,600.00","7,600.00",RB11,RB1,RB00,1,BG00012711, SCIENTIFIC PROMOTION CO.
3/6/2019,4500148570,20,,ค่าบริการซ่อมเครื่อง,1,JOB,THB,"3,500.00","3,500.00",RB11,RB1,RB00,1,BG00012711, SCIENTIFIC PROMOTION CO.
3/6/2019,4500148570,30,,Delivery Charge,1,JOB,THB,700.00,700.00,RB11,RB1,RB00,1,BG00012711, SCIENTIFIC PROMOTION CO.
3/19/2019,4500149881,10,,ซ่อมเครื่อง Viscometer รุ่น LVDV-E,1,JOB,THB,"8,250.00","8,250.00",RB11,RB1,RB00,1,BG00012711, SCIENTIFIC PROMOTION CO.
3/8/2019,4500149603,10,,ส่งตัวอย่างตรวจสอบ 1 sample,1,EA,THB,"11,500.00","11,500.00",RB11,RB3,RB00,1,BG00012712, SGS (THAILAND) LTD.
3/7/2019,4500149317,10,,Service charge for DC-211,1,JOB,THB,"63,750.00","63,750.00",RB11,RB2,RB00,1,BG00012725, SIWA TESTING INSPECTION
3/6/2019,4500148472,10,,ซ่อมเครื่อง Viscometer รุ่น LVDV-E,1,EA,THB,"7,600.00","7,600.00",RB11,RB1,RB00,1,BG00012735, SPC CALIBRATION CENTER
3/6/2019,4500148472,20,,ค่าบริการซ่อมเครื่อง,1,JOB,THB,"3,500.00","3,500.00",RB11,RB1,RB00,1,BG00012735, SPC CALIBRATION CENTER
3/6/2019,4500148472,30,,Delivery Charge,1,JOB,THB,700.00,700.00,RB11,RB1,RB00,1,BG00012735, SPC CALIBRATION CENTER
3/25/2019,4500149848,10,,"บอลวาล์ว PVC 2""เกลียว",10,EA,THB,140.00,"1,400.00",RB11,RB1,RB00,1,BG00012781, THARNTHONG SUVARNABHUMI
3/25/2019,4500149848,20,,"บอลวาล์วทองเหลืองชุบขาว VRF 2""",10,EA,THB,482.00,"4,820.00",RB11,RB1,RB00,1,BG00012781, THARNTHONG SUVARNABHUMI
3/12/2019,4500148978,10,,ลัางถังพลาสติก 1000 ลิตร,25,EA,THB,800.00,"20,000.00",RB11,RB3,RB00,1,BG00012785, THEPRASIT BUSINESS LTD P
3/15/2019,4500149601,10,,"ล้างถังพลาสติกขนาด 1,000 ลิตร",27,EA,THB,800.00,"21,600.00",RB11,RB3,RB00,1,BG00012785, THEPRASIT BUSINESS LTD P
3/29/2019,4500150434,10,,กระป๋องเหลี่ยมวิลาศ 1/4 แกลลอน พร้อมฝา,500,EA,THB,20.00,"10,000.00",RB11,RB1,RB00,1,BG00012791," TINCAN INDUSTRY CO., LTD"
3/20/2019,4500149560,10,,Total Jarytherm DBT (200Kg)IRS=1.5 ถัง,1,EA,THB,"88,500.00","88,500.00",RB11,RB0,RB00,1,BG00012806, TOTAL OIL (THAILAND) CO.
3/20/2019,4500149560,20,,Total Jarytherm DBT (200Kg)IRW= 1.5 ถัง,1,EA,THB,"88,500.00","88,500.00",RB11,RB0,RB00,1,BG00012806, TOTAL OIL (THAILAND) CO.
3/19/2019,4500149468,10,,"ข้อต่อวาล์วซุปเปอร์ลีน 2"" อลูมิเนียม",10,EA,THB,850.00,"8,500.00",RB11,RB1,RB00,1,BG00012810, TSP PART AND ENGINEERING
3/19/2019,4500149468,20,,"ข้อต่อวาล์ว PVC 2""",10,EA,THB,520.00,"5,200.00",RB11,RB1,RB00,1,BG00012810, TSP PART AND ENGINEERING
3/12/2019,4500149325,10,,Chemical Testing,3,EA,THB,"4,200.00","12,600.00",RB11,RB1,RB00,1,BG00012812, TUV RHEINLAND THAILAND L
3/5/2019,4500148358,10,,ผ้ากรอง 150 mesh,106,M,THB,130.00,"13,780.00",RB11,RB1,RB00,1,BG00012825," V.S. BURLY GROUP CO., LT"
3/22/2019,4500150034,10,,Check Signal of Level in Tank (WH-IRW),1,JOB,THB,"24,050.00","24,050.00",RB11,RB1,RB00,1,BG00012839," WILLOW GLOBAL CO., LTD."
3/22/2019,4500150034,20,,Check Signal of Level in Tank (WH-IRS),1,JOB,THB,"24,050.00","24,050.00",RB11,RB1,RB00,1,BG00012839," WILLOW GLOBAL CO., LTD."
3/26/2019,4500150385,20,,Sample can (free of charge),500,PC,THB,0.00,0.00,RB11,RB0,RB00,1,BG00012851, NIHON GOSEI KAKO (THAILA
3/11/2019,4500149888,10,,เปลี่ยนน้ำมันเครื่อง F-11,1,JOB,THB,"5,922.50","5,922.50",RB11,RB1,RB00,1,BG00014490," Zen Service Co.,Ltd."
3/11/2019,4500149889,10,,เปลี่ยนน้ำมันเครื่อง F-11,1,JOB,THB,"5,922.50","5,922.50",RB11,RB1,RB00,1,BG00014490," Zen Service Co.,Ltd."
3/11/2019,4500149890,10,,เปลี่ยนน้ำมันเครื่อง F-16,1,JOB,THB,"5,922.50","5,922.50",RB11,RB1,RB00,1,BG00014490," Zen Service Co.,Ltd."
3/11/2019,4500149891,10,,ซ่อม Forklift F-4,1,JOB,THB,"8,022.50","8,022.50",RB11,RB3,RB00,1,BG00014490," Zen Service Co.,Ltd."
3/4/2019,4500149179,10,,GS Battery N150 12V 150AH,2,EA,THB,"6,300.00","12,600.00",RB11,RB1,RB00,1,BG00015750," MEMBER TECH CO.,LTD."
3/6/2019,4500149181,10,,อุปกรณ์สำหรับซ่อมลิฟท์ขนของ 8 item (PD),1,JOB,THB,"2,320.00","2,320.00",RB11,RB0,RB00,1,BG00015750," MEMBER TECH CO.,LTD."
3/6/2019,4500149181,20,,อุปกรณ์สำหรับซ่อมลิฟท์ขนของ 8 item (MA),1,JOB,THB,"3,500.00","3,500.00",RB11,RB0,RB00,1,BG00015750," MEMBER TECH CO.,LTD."
3/6/2019,4500149181,30,,อุปกรณ์สำหรับซ่อมลิฟท์ขนของ 8 item (HR),1,JOB,THB,"1,995.00","1,995.00",RB11,RB0,RB00,1,BG00015750," MEMBER TECH CO.,LTD."
3/7/2019,4500149183,10,,เหล็กแผ่นดำ 4'x8'x3 mm.,3,PC,THB,"2,580.00","7,740.00",RB11,RB0,RB00,1,BG00015750," MEMBER TECH CO.,LTD."
3/7/2019,4500149183,20,,เหล็กแผ่นดำ 2'x2' หนา 4 mm.,18,EA,THB,530.00,"9,540.00",RB11,RB0,RB00,1,BG00015750," MEMBER TECH CO.,LTD."
3/7/2019,4500149196,10,,อุปกรณ์เปลี่ยนยางล้อ BSA mixing tank(PD),1,JOB,THB,"15,900.00","15,900.00",RB11,RB0,RB00,1,BG00015750," MEMBER TECH CO.,LTD."
3/7/2019,4500149196,20,,เปลี่ยนยางล้อ BSA mixing tank(MA),1,JOB,THB,"2,300.00","2,300.00",RB11,RB0,RB00,1,BG00015750," MEMBER TECH CO.,LTD."
3/13/2019,4500149918,10,,"งานเปลี่ยนโช้คประตูเลื่อน,สายพาน RD",1,JOB,THB,"1,450.00","1,450.00",RB11,RB0,RB00,1,BG00015750," MEMBER TECH CO.,LTD."
3/13/2019,4500149918,20,,"งานเปลี่ยนโช้คประตูเลื่อน,สายพาน MA",1,JOB,THB,"5,516.00","5,516.00",RB11,RB0,RB00,1,BG00015750," MEMBER TECH CO.,LTD."
3/13/2019,4500149918,30,,"งานเปลี่ยนโช้คประตูเลื่อน,สายพาน WH",1,JOB,THB,"5,500.00","5,500.00",RB11,RB0,RB00,1,BG00015750," MEMBER TECH CO.,LTD."
3/13/2019,4500149921,10,,เพิ่มความสูงHanrail(ท่อเหล็ก ข้องอ เหล็ก,1,JOB,THB,"7,810.00","7,810.00",RB11,RB3,RB00,1,BG00015750," MEMBER TECH CO.,LTD."
3/11/2019,4500149923,10,,PHILIPS MERCURY LAMP HPL-N 250W E-40,12,JOB,THB,285.00,"3,420.00",RB11,RB0,RB00,1,BG00015750," MEMBER TECH CO.,LTD."
3/11/2019,4500149923,20,,PHILIPS MERCURY LAMP HPL-N 250W E-40,12,JOB,THB,240.00,"2,880.00",RB11,RB0,RB00,1,BG00015750," MEMBER TECH CO.,LTD."
3/11/2019,4500149923,30,,PHILIPS FLOOD LIGHT LED SMARTBRIGHT,1,EA,THB,"3,590.00","3,590.00",RB11,RB0,RB00,1,BG00015750," MEMBER TECH CO.,LTD."
