Document Date,purchasing document,item,material,short text,order quantity,order unit,currency,net price,net order value,plant,purchasing group,purchasing organization,price unit,supplier_code,supplier_name
12/12/2018,4500142849,10,,Paper Sticker for Label Printer,24,EA,THB,350,8400,RB11,RB2,RB00,1,BG00012100, CHANWATTANA  SCALE SALE
12/14/2018,4500142854,10,,Repair Floor Scale 300 kg.,1,JOB,THB,12500,12500,RB11,RB2,RB00,1,BG00012100, CHANWATTANA  SCALE SALE
12/13/2018,4500142652,10,,"เครื่องดับเพลิง""Anti-Fire""ชนิดผงเคมีแห้ง",19,SET,THB,1380,26220,RB11,RB0,RB00,1,BG00012103," ANTI FIRE INDUSTRY CO.,"
12/25/2018,4500143456,10,,Customs duty&tax (INV.K38-0906-2),1,EA,THB,3634,3634,RB11,RB2,RB00,1,BG00012126, CUSTOM DEPARTMENT
12/13/2018,4500142611,10,,Member fee January-December 2019,1,JOB,THB,23540,23540,RB11,RB0,RB00,1,BG00012142, Green Valley Courntry Cl
12/27/2018,4500143699,10,,Insurance Policy,1,JOB,THB,3708,3708,RB11,RB0,RB00,1,BG00012168, MITSUI SUMITOMO INSURANC
12/13/2018,4500142640,10,,Membership fee from 1 Dec18-30 Nov19,1,JOB,THB,10000,10000,RB11,RB0,RB00,1,BG00012172, MOTHER BRAIN (THAILAND)
12/7/2018,4500142187,10,,GCMS 5977 Turbo system,2,JOB,THB,173553.6,347107.2,RB11,RB1,RB00,1,BG00012322, AGILENT TECHNOLOGIES (TH
12/20/2018,4500143490,10,,ค่าบริการทดสอบน้ำหนักเครนไฟฟ้า (PD-IRS),1,JOB,THB,36000,36000,RB11,RB0,RB00,1,BG00012325, ALLA PUBLIC COMPANY LIMI
12/20/2018,4500143490,20,,ค่าบริการทดสอบน้ำหนักเครนไฟฟ้า (RD-CC),1,JOB,THB,12000,12000,RB11,RB0,RB00,1,BG00012325, ALLA PUBLIC COMPANY LIMI
12/11/2018,4500142465,10,,BulkStrap Model: BS65,2,EA,THB,5600,11200,RB11,RB2,RB00,1,BG00012348," ATMET PACKAGING CO., LTD"
12/11/2018,4500142465,20,,BulkStrap Model: BS85,1,EA,THB,7200,7200,RB11,RB2,RB00,1,BG00012348," ATMET PACKAGING CO., LTD"
12/11/2018,4500142465,30,,Buckles Model: BB6 (for BS65),2,EA,THB,2800,5600,RB11,RB2,RB00,1,BG00012348," ATMET PACKAGING CO., LTD"
12/11/2018,4500142465,40,,Buckles Model: BB8 (for BS85),1,EA,THB,3200,3200,RB11,RB2,RB00,1,BG00012348," ATMET PACKAGING CO., LTD"
12/17/2018,4500143435,10,,Hard disc for DCS Computer(IRW),1,EA,THB,4000,4000,RB11,RB0,RB00,1,BG00012350," AZBIL (THAILAND) CO., LT"
12/17/2018,4500143435,20,,Hard disc for DCS Computer(IRS),1,EA,THB,4000,4000,RB11,RB0,RB00,1,BG00012350," AZBIL (THAILAND) CO., LT"
12/17/2018,4500143317,10,,Hard disc for DCS Computer IRW,1,JOB,THB,4000,4000,RB11,RB1,RB00,1,BG00012351," AZBIL (THAILAND) CO., LT"
12/17/2018,4500143317,20,,Hard disc for DCS Computer IRS,1,JOB,THB,4000,4000,RB11,RB1,RB00,1,BG00012351," AZBIL (THAILAND) CO., LT"
12/14/2018,4500143301,10,,ค่ากำจัด Commercial Waste,2380,KG,THB,2.8,6664,RB11,RB0,RB00,1,BG00012356, BANGPOO ENVIRONMENTAL CO
12/14/2018,4500143301,20,,Collection Fee,1,EA,THB,4250,4250,RB11,RB0,RB00,1,BG00012356, BANGPOO ENVIRONMENTAL CO
12/17/2018,4500143492,10,,ค่าบริการกำจัดและบำบัดเรซิ่นเสื่อมสภาาพ,6910,KG,THB,2.8,19348,RB11,RB2,RB00,1,BG00012366, BETTER WORLD GREEN PUBLI
12/17/2018,4500143492,20,,ค่าบริการกำจัดและบำบัดเรซิ่นเสื่อมสภาาพ,5460,KG,THB,2.8,15288,RB11,RB2,RB00,1,BG00012366, BETTER WORLD GREEN PUBLI
12/17/2018,4500143492,30,,ค่าขนส่ง (เที่ยว),2,EA,THB,5000,10000,RB11,RB2,RB00,1,BG00012366, BETTER WORLD GREEN PUBLI
12/27/2018,4500143681,10,,ค่าบริการกำจัด&บำบัดเรซิ่นเสื่อมสภาาพIRS,1,JOB,THB,6785.5,6785.5,RB11,RB0,RB00,1,BG00012366, BETTER WORLD GREEN PUBLI
12/27/2018,4500143681,20,,ค่าบริการกำจัด&บำบัดเรซิ่นเสื่อมสภาาพIRW,1,JOB,THB,1774.21,1774.21,RB11,RB0,RB00,1,BG00012366, BETTER WORLD GREEN PUBLI
12/27/2018,4500143681,30,,ค่าบริการกำจัด&บำบัดเรซิ่นเสื่อมสภาาพUU,1,JOB,THB,7085.89,7085.89,RB11,RB0,RB00,1,BG00012366, BETTER WORLD GREEN PUBLI
12/24/2018,4500143406,10,,ค่าการตรวจวัดสิ่งแวดล้อม,1,JOB,THB,107660,107660,RB11,RB0,RB00,1,BG00012389, CHEMLAB SERVICES (THAILA
12/21/2018,4500143445,10,,งานตั้งนั่งร้านเพิ่ม 1 จุด,1,JOB,THB,7500,7500,RB11,RB1,RB00,1,BG00012462," GEWINN ENGINEERING CO.,"
12/21/2018,4500143445,20,,Transprtation,1,JOB,THB,1000,1000,RB11,RB1,RB00,1,BG00012462," GEWINN ENGINEERING CO.,"
12/21/2018,4500143445,30,,Site Safety,1,JOB,THB,1000,1000,RB11,RB1,RB00,1,BG00012462," GEWINN ENGINEERING CO.,"
12/21/2018,4500143446,10,,Repair agitator Shaft,1,JOB,THB,120000,120000,RB11,RB1,RB00,1,BG00012462," GEWINN ENGINEERING CO.,"
12/21/2018,4500143493,10,,ค่านั่งร้าน,1,JOB,THB,7500,7500,RB11,RB1,RB00,1,BG00012462," GEWINN ENGINEERING CO.,"
12/21/2018,4500143493,20,,Transprtation,1,JOB,THB,1000,1000,RB11,RB1,RB00,1,BG00012462," GEWINN ENGINEERING CO.,"
12/21/2018,4500143493,30,,Site Safety,1,JOB,THB,1000,1000,RB11,RB1,RB00,1,BG00012462," GEWINN ENGINEERING CO.,"
12/4/2018,4500141907,10,,งานต่อเติมห้องล้างถัง,1,EA,THB,73000,73000,RB11,RB2,RB00,1,BG00012463," GEWINN ENGINEERING CO.,"
12/7/2018,4500142275,10,,ค่าบริการรับ-ส่งและตรวจเช็ค,1,EA,THB,6000,6000,RB11,RB1,RB00,1,BG00012474, H.J. UNKEL (THAI) LIMITE
12/12/2018,4500143313,10,,งานวัดความหนาของปล่องไอเสียของ Boiler 6T,1,JOB,THB,60000,60000,RB11,RB0,RB00,1,BG00012477," HANSA INTERNATIONAL CO.,"
12/12/2018,4500143313,20,,ค่าบริการเจ้าหน้าที่เข้าดำเนินการ,1,JOB,THB,7000,7000,RB11,RB0,RB00,1,BG00012477," HANSA INTERNATIONAL CO.,"
12/21/2018,4500143469,10,,ค่าบริการบำรุงรักษา Boiler 6 tons,1,JOB,THB,46800,46800,RB11,RB0,RB00,1,BG00012477," HANSA INTERNATIONAL CO.,"
12/13/2018,4500142651,10,,ฝาครอบถังขนาดใหญ่,10000,EA,THB,2.9,29000,RB11,RB2,RB00,1,BG00012481," HOONG HUAT PLASTIC LTD.,"
12/13/2018,4500142651,20,,ฝาครอบถังขนาดเล็ก,10000,EA,THB,1.45,14500,RB11,RB2,RB00,1,BG00012481," HOONG HUAT PLASTIC LTD.,"
12/13/2018,4500142666,10,,ถุงมือผ้า (โหล),50,EA,THB,70,3500,RB11,RB0,RB00,1,BG00012500, J & S SAFETY SUPPLY LTD.
12/13/2018,4500142666,20,,ตลับกรองหน้ากากครึ่งหน้า 3M.7007K-100,30,EA,THB,150,4500,RB11,RB0,RB00,1,BG00012500, J & S SAFETY SUPPLY LTD.
12/13/2018,4500142666,30,,ผ้าปิดจมูก (โหล),100,EA,THB,28,2800,RB11,RB0,RB00,1,BG00012500, J & S SAFETY SUPPLY LTD.
12/13/2018,4500142666,40,,แผ่นกรองฝุ่น 3M-7711,50,EA,THB,36,1800,RB11,RB0,RB00,1,BG00012500, J & S SAFETY SUPPLY LTD.
12/13/2018,4500142666,50,,ถุงมือพลาสติก (คู่),3000,EA,THB,1.2,3600,RB11,RB0,RB00,1,BG00012500, J & S SAFETY SUPPLY LTD.
12/20/2018,4500143303,10,,ค่าบริการล้างทำความสะอาด Drum,2520,EA,THB,3,7560,RB11,RB1,RB00,1,BG00012511," K.S. WASTE RECOVERY CO.,"
12/20/2018,4500143303,20,,ค่าบริการล้างทำความสะอาด Drum คุมเครื่อง,2520,EA,THB,5,12600,RB11,RB1,RB00,1,BG00012511," K.S. WASTE RECOVERY CO.,"
12/20/2018,4500143303,30,,ค่าบริการล้างทำความสะอาด Bulk,547,EA,THB,60,32820,RB11,RB1,RB00,1,BG00012511," K.S. WASTE RECOVERY CO.,"
12/20/2018,4500143303,40,,ค่าบริการล้างทำความสะอาด Bulk(E),6,EA,THB,100,600,RB11,RB1,RB00,1,BG00012511," K.S. WASTE RECOVERY CO.,"
12/20/2018,4500143440,10,,ค่ากำจัด Wastewater Sludge TMS180054,24030,KG,THB,3.2,76896,RB11,RB1,RB00,1,BG00012511," K.S. WASTE RECOVERY CO.,"
12/20/2018,4500143440,20,,ค่ากำจัด Wastewater Sludge TMS18055,12260,KG,THB,3.2,39232,RB11,RB1,RB00,1,BG00012511," K.S. WASTE RECOVERY CO.,"
12/20/2018,4500143441,10,,ค่ากำจัดน้ำเสียจากการดักจับไอระเหย 1,29760,KG,THB,4.8,142848,RB11,RB2,RB00,1,BG00012511," K.S. WASTE RECOVERY CO.,"
12/20/2018,4500143441,20,,ค่ากำจัดน้ำเสียจากการดักจับไอระเหย 2,27280,KG,THB,4.8,130944,RB11,RB2,RB00,1,BG00012511," K.S. WASTE RECOVERY CO.,"
12/20/2018,4500143441,30,,ค่ากำจัดน้ำเสียจากการดักจับไอระเหย 3,29840,KG,THB,4.8,143232,RB11,RB2,RB00,1,BG00012511," K.S. WASTE RECOVERY CO.,"
12/20/2018,4500143442,10,,ค่ากำจัดเศษโฟม 1 เที่ยว,1,JOB,THB,13500,13500,RB11,RB3,RB00,1,BG00012511," K.S. WASTE RECOVERY CO.,"
12/20/2018,4500143443,10,,ค่ากำจัด Contaminated Materials,3270,KG,THB,7.2,23544,RB11,RB1,RB00,1,BG00012511," K.S. WASTE RECOVERY CO.,"
12/6/2018,4500142152,10,,กระดาษกรอง Whatman เบอร์ 2,3,EA,THB,1550,4650,RB11,RB1,RB00,1,BG00012527, LAB VALLEY LIMITED PARTN
12/6/2018,4500142152,20,,"THF AR, 2.5 L.",16,EA,THB,1550,24800,RB11,RB1,RB00,1,BG00012527, LAB VALLEY LIMITED PARTN
12/6/2018,4500142157,10,,ถุงมือแพทย์ชนิดไม่มีแป้ง Size M(50คู่),30,EA,THB,190,5700,RB11,RB2,RB00,1,BG00012527, LAB VALLEY LIMITED PARTN
12/6/2018,4500142157,20,,ถุงมือแพทย์ชนิดไม่มีแป้ง Size L (50 คู่),30,EA,THB,190,5700,RB11,RB2,RB00,1,BG00012527, LAB VALLEY LIMITED PARTN
12/6/2018,4500142157,30,,เทอร์โมมิเตอร์ ช่วง 0-200 C ไส้แอลกอฮอล์,12,EA,THB,120,1440,RB11,RB2,RB00,1,BG00012527, LAB VALLEY LIMITED PARTN
12/4/2018,4500141910,10,,ขวดยาหม่องพร้อมฝา (532 ใบ/กล่อง),10,EA,THB,1463,14630,RB11,RB2,RB00,1,BG00012530," LARPJIRAPUS CO., LTD."
12/4/2018,4500141973,10,,Nitrogen UHP,2,EA,THB,801,1602,RB11,RB1,RB00,1,BG00012538, LINDE(THAILAND)PUBLIC CO
12/4/2018,4500141973,20,,Helium UHP,1,EA,THB,11686.5,11686.5,RB11,RB1,RB00,1,BG00012538, LINDE(THAILAND)PUBLIC CO
12/4/2018,4500141973,30,,Delivery for Nitrogen,2,EA,THB,60,120,RB11,RB1,RB00,1,BG00012538, LINDE(THAILAND)PUBLIC CO
12/4/2018,4500141973,40,,Delivery for Helium,1,EA,THB,40,40,RB11,RB1,RB00,1,BG00012538, LINDE(THAILAND)PUBLIC CO
12/3/2018,4500141883,10,,คูปองน้ำดื่ม,720,EA,THB,33,23760,RB11,RB0,RB00,1,BG00012547, M. WATER
12/21/2018,4500143250,10,,หมึก Epson GJIC4(K),6,EA,THB,2400,14400,RB11,RB1,RB00,1,BG00012562, METRO SYSTEMS CORP. PUBL
12/21/2018,4500143250,20,,หมึก Epson GJIC4(C),5,EA,THB,800,4000,RB11,RB1,RB00,1,BG00012562, METRO SYSTEMS CORP. PUBL
12/21/2018,4500143250,30,,หมึก Epson GJIC4(M),5,EA,THB,800,4000,RB11,RB1,RB00,1,BG00012562, METRO SYSTEMS CORP. PUBL
12/21/2018,4500143250,40,,หมึก Epson GJIC4(Y),5,EA,THB,800,4000,RB11,RB1,RB00,1,BG00012562, METRO SYSTEMS CORP. PUBL
12/1/2018,4500142131,10,,ARIEL WEBINSIGHT,1,EA,JPY,50000,50000,RB11,RB0,RB00,1,BG00012568," MITSUI CHEMICALS, INC."
12/1/2018,4500142131,20,,ARIEL WEBINSIGHT,1,EA,JPY,50000,50000,RB11,RB0,RB00,1,BG00012568," MITSUI CHEMICALS, INC."
12/20/2018,4500143126,10,,Air Condition Unit System 10 sets(30%),1,EA,THB,221100,221100,RB11,RB0,RB00,1,BG00012613, P.A.P. ENERGY SAVE CENTR
12/4/2018,4500142459,10,,"ASSHOSE611100 FMA304-3/4"" x 4 M(OL)",1,EA,THB,5700,5700,RB11,RB3,RB00,1,BG00012619," P.P.B. HYDRAULIC CO., LT"
12/13/2018,4500142848,10,,"ASSHOSE6111379-1 PRAS(ลวด)2""x40M.",1,EA,THB,22000,22000,RB11,RB3,RB00,1,BG00012619," P.P.B. HYDRAULIC CO., LT"
12/13/2018,4500142848,20,,"ASSHOSE6111379-1 TOYOX(ลวด)2""x40M.",1,EA,THB,28600,28600,RB11,RB3,RB00,1,BG00012619," P.P.B. HYDRAULIC CO., LT"
12/7/2018,4500142188,10,,Packing Area Improvement (30%),1,EA,THB,210000,210000,RB11,RB2,RB00,1,BG00012631, PCA ENGINEERING & SERVIC
12/4/2018,4500141911,10,,"Calculator""Casio""#DX-120B",1,SET,THB,350,350,RB11,RB0,RB00,1,BG00012656," PORN THAVEE OA CO., LTD."
12/19/2018,4500143426,10,,ตรวจเช็คหม้อแปลงไฟฟ้า1250KVA TR-1,1,JOB,THB,66400,66400,RB11,RB2,RB00,1,BG00012680, R ENGINEERING SUPPORT CO
12/13/2018,4500142662,10,,TOYOSPRING TS-50 (50x62)40 ม.,1,EA,THB,23887,23887,RB11,RB2,RB00,1,BG00012682, RATTANAKOSIN HYDRAULIC (
12/13/2018,4500142662,20,,TOYOSPRING TS-32 (32x41)40 ม.,1,EA,THB,10687,10687,RB11,RB2,RB00,1,BG00012682, RATTANAKOSIN HYDRAULIC (
12/11/2018,4500142396,10,,ใบ Work Permit แบบ Gerner work (สีเขียว),50,EA,THB,180,9000,RB11,RB0,RB00,1,BG00012690, S.RUNGCHAI PUBLISHING  C
12/11/2018,4500142396,20,,ใบ Work Permit แบบ Hot work (สีชมพู),50,EA,THB,180,9000,RB11,RB0,RB00,1,BG00012690, S.RUNGCHAI PUBLISHING  C
12/18/2018,4500143425,10,,ทดสอบน้ำหนักลิฟท์ รุ่น P9-C060-4/4,1,EA,THB,8000,8000,RB11,RB0,RB00,1,BG00012716, SIAM ELEVATOR & ESCALATO
12/3/2018,4500141856,10,,"Rotaly joint for N-2,4/N-2N,3N,4N TS29",2,EA,THB,5310,10620,RB11,RB1,RB00,1,BG00012723, SITHIPORN ASSOCIATES CO.
12/17/2018,4500142812,10,,"Rotary joint for N-2,4/N-2N,3N,4N TS29",2,PC,THB,5310,10620,RB11,RB1,RB00,1,BG00012723, SITHIPORN ASSOCIATES CO.
12/6/2018,4500142813,10,,ซ่อมมอเตอร์ไดโว่ 0.75 KW 1HP 2P ตัวใหญ่,1,JOB,THB,9620,9620,RB11,RB1,RB00,1,BG00012733, SOMCHIT TECHNIC MOTOR LT
12/6/2018,4500142394,10,,"Cal.Oven""TA BAL"" รุ่น IPH-200",2,JOB,THB,4050,8100,RB11,RB1,RB00,1,BG00012735, SPC CALIBRATION CENTER
12/6/2018,4500142394,20,,"Cal.Oven""Yamato"" รุ่น DK-43",1,JOB,THB,4050,4050,RB11,RB1,RB00,1,BG00012735, SPC CALIBRATION CENTER
12/6/2018,4500142394,30,,"Cal.Oven""Binder"" รุ่น FP 53 S/N 11-15232",1,JOB,THB,4050,4050,RB11,RB1,RB00,1,BG00012735, SPC CALIBRATION CENTER
12/6/2018,4500142394,40,,Vacuum Oven ยี่ห้อ Binder รุ่น VDL53,1,JOB,THB,4500,4500,RB11,RB1,RB00,1,BG00012735, SPC CALIBRATION CENTER
12/6/2018,4500142394,50,,Humidity Chamber ยี่ห้อ Binder MKF240,1,JOB,THB,4950,4950,RB11,RB1,RB00,1,BG00012735, SPC CALIBRATION CENTER
12/6/2018,4500142394,60,,ค่าบริการสอบเทียบ,1,JOB,THB,950,950,RB11,RB1,RB00,1,BG00012735, SPC CALIBRATION CENTER
12/14/2018,4500142758,10,,ค่าอะไหล่ For Viscometer Model: LVDV-E,1,EA,THB,5000,5000,RB11,RB1,RB00,1,BG00012735, SPC CALIBRATION CENTER
12/20/2018,4500143403,10,,ค่าบริการสอบเทียบ Oven ยี่ห้อ Eyala,1,SET,THB,4050,4050,RB11,RB1,RB00,1,BG00012735, SPC CALIBRATION CENTER
12/20/2018,4500143403,20,,ค่าบริการสอบเทียบ Oven ยี่ห้อ Binder,3,SET,THB,4050,12150,RB11,RB1,RB00,1,BG00012735, SPC CALIBRATION CENTER
12/20/2018,4500143403,30,,ค่าเดินทางสอบเทียบ,1,JOB,THB,950,950,RB11,RB1,RB00,1,BG00012735, SPC CALIBRATION CENTER
12/12/2018,4500142567,10,,Tin plate,20,EA,THB,750,15000,RB11,RB2,RB00,1,BG00012777, THANAPHON MACHINERY
12/3/2018,4500141886,10,,ปี๊บเหล็ก 343mm x174 mm.x1/4 กล.,500,EA,THB,20,10000,RB11,RB2,RB00,1,BG00012791," TINCAN INDUSTRY CO., LTD"
12/3/2018,4500141886,20,,ปี๊บใหญี 1.5 นิ้ว คอ 1.5นิ้วย ขนาด 1 กล.,500,EA,THB,30,15000,RB11,RB2,RB00,1,BG00012791," TINCAN INDUSTRY CO., LTD"
12/21/2018,4500143463,10,,(Topken) Mechanical Seal TK-S30,1,SET,THB,7140,7140,RB11,RB1,RB00,1,BG00012792, TK Engineering and Parts
12/11/2018,4500142439,10,,ซ่อมเครื่อง TOHO NR-215,1,JOB,THB,9500,9500,RB11,RB3,RB00,1,BG00012796," TOKIO ENGINEERING CO., L"
12/11/2018,4500142439,20,,Consumption,1,JOB,THB,1000,1000,RB11,RB3,RB00,1,BG00012796," TOKIO ENGINEERING CO., L"
12/11/2018,4500142439,30,,Transportation,1,JOB,THB,1500,1500,RB11,RB3,RB00,1,BG00012796," TOKIO ENGINEERING CO., L"
12/11/2018,4500142443,10,,สายน้ำยาเคมี Hose(ISO)3R80-08x910,1,PC,THB,4200,4200,RB11,RB3,RB00,1,BG00012796," TOKIO ENGINEERING CO., L"
12/11/2018,4500142443,20,,สายน้ำยาเคมี Hose(ISO)3R80-08x380,1,PC,THB,3500,3500,RB11,RB3,RB00,1,BG00012796," TOKIO ENGINEERING CO., L"
12/11/2018,4500142443,30,,"สายน้ำยาเคมี Hose(ISO)3R80-06x4,330",1,PC,THB,7400,7400,RB11,RB3,RB00,1,BG00012796," TOKIO ENGINEERING CO., L"
12/21/2018,4500143407,10,,Free Converyor for Loadcell,1,SET,THB,18500,18500,RB11,RB3,RB00,1,BG00012809, Triple-L Engineering and
12/24/2018,4500143408,10,,Main for Loadcell,1,SET,THB,5500,5500,RB11,RB3,RB00,1,BG00012809, Triple-L Engineering and
12/14/2018,4500142899,10,,ส่งตัวอย่างทดสอบ TUV,2,EA,THB,11000,22000,RB11,RB3,RB00,1,BG00012812, TUV RHEINLAND THAILAND L
12/7/2018,4500143318,10,,ซ่อม Forklift F-14,1,JOB,THB,23700,23700,RB11,RB3,RB00,1,BG00014490," Zen Service Co.,Ltd."
12/7/2018,4500143320,10,,ซ่อม Forklift F-6,1,JOB,THB,7050,7050,RB11,RB2,RB00,1,BG00014490," Zen Service Co.,Ltd."
12/7/2018,4500143322,10,,ซ่อม Forklift F-16,1,JOB,THB,6600,6600,RB11,RB1,RB00,1,BG00014490," Zen Service Co.,Ltd."
12/7/2018,4500143325,10,,ซ่อม Forklift F-19,1,JOB,THB,11675,11675,RB11,RB1,RB00,1,BG00014490," Zen Service Co.,Ltd."
12/7/2018,4500143326,10,,ซ่อม Forklift F-14,1,JOB,THB,24800,24800,RB11,RB3,RB00,1,BG00014490," Zen Service Co.,Ltd."
12/14/2018,4500143329,10,,ซ่อม Forklift F-20,1,JOB,THB,21575,21575,RB11,RB2,RB00,1,BG00014490," Zen Service Co.,Ltd."
12/18/2018,4500143466,10,,ซ่อม Forklift F13,1,JOB,THB,9975,9975,RB11,RB2,RB00,1,BG00014490," Zen Service Co.,Ltd."
12/11/2018,4500142461,10,,Wax RIKEISAI O-500 (13 KGs / Pail),130,KG,THB,125,16250,RB11,RB3,RB00,1,BG00014547," NAGASE (THAILAND) CO., L"
12/25/2018,4500143455,10,,Duty & tax for lab (K38-0906-2),1,EA,THB,11744,11744,RB11,RB3,RB00,1,BG00014559, CUSTOM DEPARTMENT
12/3/2018,4500141879,10,,ฟิล์ม HM50-1800-G 50 cm.x1800 m.x20 Mic,15,EA,THB,1180,17700,RB11,RB1,RB00,1,BG00014562," NANDEE -STRAPAC CO.,LTD."
12/11/2018,4500142827,10,,SMC AIR UNIT AW40-04G-A,2,EA,THB,2120,4240,RB11,RB0,RB00,1,BG00015750," MEMBER TECH CO.,LTD."
12/11/2018,4500142827,20,,SMC AIR UNIT AW30-02G-A,7,EA,THB,1400,9800,RB11,RB0,RB00,1,BG00015750," MEMBER TECH CO.,LTD."
12/7/2018,4500142836,10,,อุปกรณ์สำหรับงานซ่อมแซม Spare (MA-CC),1,JOB,THB,9370,9370,RB11,RB0,RB00,1,BG00015750," MEMBER TECH CO.,LTD."
12/6/2018,4500142839,10,,อุปกรณ์ใช้ในงานSTM line และ MAทั่วไป(WH),1,JOB,THB,1155,1155,RB11,RB0,RB00,1,BG00015750," MEMBER TECH CO.,LTD."
12/6/2018,4500142839,20,,อุปกรณ์ใช้ในงานSTM line และ MAทั่วไป(MA),1,JOB,THB,3355,3355,RB11,RB0,RB00,1,BG00015750," MEMBER TECH CO.,LTD."
12/6/2018,4500142839,30,,อุปกรณ์ใช้ในงานSTM line และ MAทั่วไป(PD),1,JOB,THB,2300,2300,RB11,RB0,RB00,1,BG00015750," MEMBER TECH CO.,LTD."
12/6/2018,4500142841,10,,Spare งานจัดสายไฟและซ่อมแซมทั่วไป MA,1,JOB,THB,3990,3990,RB11,RB0,RB00,1,BG00015750," MEMBER TECH CO.,LTD."
12/6/2018,4500142841,20,,Spare งานจัดสายไฟและซ่อมแซมทั่วไป HR,1,JOB,THB,325,325,RB11,RB0,RB00,1,BG00015750," MEMBER TECH CO.,LTD."
12/6/2018,4500142841,30,,Spare งานจัดสายไฟและซ่อมแซมทั่วไป UT,1,JOB,THB,880,880,RB11,RB0,RB00,1,BG00015750," MEMBER TECH CO.,LTD."
12/20/2018,4500143447,10,,อุปกรณ์สำหรับงานซ่อมแซมรวม 8 รายการ,1,JOB,THB,19400,19400,RB11,RB0,RB00,1,BG00015750," MEMBER TECH CO.,LTD."
12/20/2018,4500143447,20,,อุปกรณ์สำหรับงานซ่อมแซมรวม 6 รายการ,1,JOB,THB,5010,5010,RB11,RB0,RB00,1,BG00015750," MEMBER TECH CO.,LTD."
12/21/2018,4500143464,10,,PARKER SOLENOID VALVE 2341,2,EA,THB,6860,13720,RB11,RB0,RB00,1,BG00015750," MEMBER TECH CO.,LTD."
12/21/2018,4500143494,10,,GS Battery N150 12V 150AH,2,EA,THB,6300,12600,RB11,RB0,RB00,1,BG00015750," MEMBER TECH CO.,LTD."
12/4/2018,4500143331,10,,ซ่อม Stopper ลานจอดรถ,1,JOB,THB,20891.75,20891.75,RB11,RB0,RB00,1,BG00015912, K.Suwit Sukkasae
12/19/2018,4500143489,10,,งานซ่อมผ้าและหลังคาห้องน้ำ PD-UU,1,EA,THB,8453.61,8453.61,RB11,RB3,RB00,1,BG00015912, K.Suwit Sukkasae
12/13/2018,4500143427,10,,"ซ่อมเครื่องปรับอากาศ ขนาด 18,125 BTU",1,JOB,THB,28900,28900,RB11,RB2,RB00,1,BG00015913, Fresh Electric Technolog
12/13/2018,4500143428,10,,"ซ่อมเครื่องปรับอากาศ ขนาด 120,000 BTU",1,JOB,THB,16700,16700,RB11,RB2,RB00,1,BG00015913, Fresh Electric Technolog
12/13/2018,4500143437,10,,"ซ่อมเครื่องปรับอากาศ ขนาด 120,000 BTU",1,SET,THB,9000,9000,RB11,RB1,RB00,1,BG00015913, Fresh Electric Technolog
12/24/2018,4500143439,10,,"ซ่อมเครื่องปรับอากาศ ขนาด 77,400 BTU",1,JOB,THB,12100,12100,RB11,RB3,RB00,1,BG00015913, Fresh Electric Technolog
12/13/2018,4500143641,10,,"ซ่อมเครื่องปรับอากาศ ขนาด77,400 BTU",1,JOB,THB,56700,56700,RB11,RB3,RB00,1,BG00015913, Fresh Electric Technolog
12/28/2018,4500143858,10,,"Mobile Phone""Samsung""",1,SET,THB,8869.63,8869.63,RB11,RB3,RB00,1,BG00016015," The Mall Group Co.,Ltd."
12/14/2018,4500142763,10,,ผ้าใบหลังคาเต็นท์ทรงเพิง ขนาด5x20 m.,1,JOB,THB,31000,31000,RB11,RB2,RB00,1,BG00016070," KIJJAROEN PABIE CO.,LTD."
12/4/2018,4500141913,10,,เครื่องเคลือบบัตร ลามิเรล(A4) LMR-220,1,SET,THB,3466.36,3466.36,RB11,RB1,RB00,1,BG00016130, COL Public Company Limit
12/13/2018,4500142638,10,,ตู้เก็บกุญแจ ครีม เอเพ็คซ์ AP-0050,1,SET,THB,906.54,906.54,RB11,RB2,RB00,1,BG00016130, COL Public Company Limit
12/25/2018,4500143462,10,,ส่งตัวอย่างทดสอบหาค่า FeSO4,7,EA,THB,1500,10500,RB11,RB1,RB00,1,BG00016189, Intertek Testing Service
12/7/2018,4500142247,10,,"Hydrochloric acid solution, 0.5N 2.5L.",6,EA,THB,1150,6900,RB11,RB3,RB00,1,BG00016313," APEX CHEMICALS CO.,LTD."
12/7/2018,4500142247,20,,"Propan-2-OL , AR 4L (LOBA)",10,EA,THB,650,6500,RB11,RB3,RB00,1,BG00016313," APEX CHEMICALS CO.,LTD."
12/7/2018,4500142247,30,,Methanol  AR 2.5L (LOBA),1,EA,THB,260,260,RB11,RB3,RB00,1,BG00016313," APEX CHEMICALS CO.,LTD."
12/13/2018,4500142614,10,,Repair AC Motor 1 Unit,1,JOB,THB,5771,5771,RB11,RB1,RB00,1,BG00016469, Performance Industrial S
12/14/2018,4500143307,10,,Overhaul Motor & Pump addition Work IRW,1,JOB,THB,118460,118460,RB11,RB0,RB00,1,BG00016469, Performance Industrial S
12/14/2018,4500143307,20,,Overhaul Motor & Pump addition Work IRS,1,JOB,THB,59915,59915,RB11,RB0,RB00,1,BG00016469, Performance Industrial S
12/14/2018,4500143307,30,,Overhaul Motor & Pump addition Work UU,1,JOB,THB,12390,12390,RB11,RB0,RB00,1,BG00016469, Performance Industrial S
12/14/2018,4500143307,40,,Overhaul Motor & Pump addition Work CC,1,JOB,THB,37290,37290,RB11,RB0,RB00,1,BG00016469, Performance Industrial S
12/18/2018,4500143432,10,,INSURANCE FOR LAB EQUIPMENT,1,EA,THB,503,503,RB11,RB1,RB00,1,BG00016511, THE WORLD PACKING&TRANSP
12/14/2018,4500142764,10,,พาเลทพลาสติก,200,EA,THB,400,80000,RB11,RB3,RB00,1,BG00017311," APTS PROVIDE CO., LTD."
12/24/2018,4500143429,10,,DIMETHYLOLPROPIONIC ACID 25kg./BG,18,KG,THB,2480,44640,RB11,RB1,RB00,1,BG00018281, MEGACHEM (THAILAND) PUBL
12/13/2018,4500142664,10,,Plunger Seal (GFP),2,EA,THB,5590,11180,RB11,RB2,RB00,1,BG00018301, S.M. CHEMICAL SUPPLIES C
12/13/2018,4500142664,20,,Inline Filter 10u,2,EA,THB,3770,7540,RB11,RB2,RB00,1,BG00018301, S.M. CHEMICAL SUPPLIES C
12/19/2018,4500143310,10,,Control Cable 8Cx1 Sq.mm,6,M,THB,400,2400,RB11,RB3,RB00,1,BG00018595, K.M.P.MACHINERY (THAILAN
12/19/2018,4500143310,20,,Push Botton 4 PBS+EMS 1 S,1,EA,THB,2500,2500,RB11,RB3,RB00,1,BG00018595, K.M.P.MACHINERY (THAILAN
12/19/2018,4500143310,30,,งานแก้ไข,1,JOB,THB,3500,3500,RB11,RB3,RB00,1,BG00018595, K.M.P.MACHINERY (THAILAN
12/19/2018,4500143310,40,,ค่าบริการ,1,JOB,THB,3500,3500,RB11,RB3,RB00,1,BG00018595, K.M.P.MACHINERY (THAILAN
12/19/2018,4500143444,10,,ค่าบริการทดสอบน้ำหนักเครน PD-IRS,1,EA,THB,10833.34,10833.34,RB11,RB0,RB00,1,BG00018595, K.M.P.MACHINERY (THAILAN
12/19/2018,4500143444,20,,ค่าบริการทดสอบน้ำหนักเครน PD-UU,1,EA,THB,10833.33,10833.33,RB11,RB0,RB00,1,BG00018595, K.M.P.MACHINERY (THAILAN
12/19/2018,4500143444,30,,ค่าบริการทดสอบน้ำหนักเครน RD-UU,1,EA,THB,10833.33,10833.33,RB11,RB0,RB00,1,BG00018595, K.M.P.MACHINERY (THAILAN
12/12/2018,4500142513,10,,"""KITZ"" Gate Valve Model: 10SMS",5,EA,THB,915,4575,RB11,RB1,RB00,1,BG00018771," PAKO ENGINEERING CO.,LTD"
12/12/2018,4500142513,20,,"""KITZ"" Gate Valve Model: 10SMBOF",1,EA,THB,10400,10400,RB11,RB1,RB00,1,BG00018771," PAKO ENGINEERING CO.,LTD"
12/3/2018,4500142613,10,,"""KITZ""Ball Valve Model: 10UTB (MA-CC)",1,SET,THB,21150,21150,RB11,RB0,RB00,1,BG00018771," PAKO ENGINEERING CO.,LTD"
