Document Date,purchasing document,item,material,short text,order quantity,order unit,currency,net price,net order value,plant,purchasing group,purchasing organization,price unit,supplier_code,supplier_name
12/3/2018,4500142613,20,,"""KITZ""Ball Valve Model: 10UTB (WH-UU)",1,SET,THB,4000,4000,RB11,RB0,RB00,1,BG00018771," PAKO ENGINEERING CO.,LTD"
12/19/2018,4500143465,10,,"Ball valve 2 PC ""KITZ"" (WH-IRS)",1,JOB,THB,13800,13800,RB11,RB2,RB00,1,BG00018771," PAKO ENGINEERING CO.,LTD"
12/19/2018,4500143465,20,,"Ball valve 1 PC ""KITZ"" (WH-UU)",1,JOB,THB,4000,4000,RB11,RB2,RB00,1,BG00018771," PAKO ENGINEERING CO.,LTD"
12/7/2018,4500142853,10,,จั๊มโบ้ Big Bag 1000 kg.,100,EA,THB,190,19000,RB11,RB1,RB00,1,BG00018897," MIONA INTERTRADE CO.,LTD"
12/17/2018,4500143410,10,,ถอด-ใส่หม้อน้ำทดลองเครื่อง,1,EA,THB,50000,50000,RB11,RB2,RB00,1,BG00019446, S.B.RADIATOR SERVICE LIM
12/18/2018,4500142997,10,,"DCS Carbinet,Power Supply,Relay and Fuse",1,EA,THB,39000,39000,RB11,RB2,RB00,1,BG00020085," CI Transfer Co.,Ltd."
12/18/2018,4500143420,10,,ค่าบำรุงรักษา New Fire Pump ธ.ค 61,1,JOB,THB,9000,9000,RB11,RB0,RB00,1,BG00020880, HARN ENGINEERING SOLUTIO
12/18/2018,4500143420,20,,ค่าบำรุงรักษา New Fire Pump ก.พ 62,1,JOB,THB,9000,9000,RB11,RB0,RB00,1,BG00020880, HARN ENGINEERING SOLUTIO
12/18/2018,4500143420,30,,ค่าบำรุงรักษา New Fire Pump เม.ย 62,1,JOB,THB,9000,9000,RB11,RB0,RB00,1,BG00020880, HARN ENGINEERING SOLUTIO
12/18/2018,4500143420,40,,ค่าบำรุงรักษา New Fire Pump มิ.ย. 62,1,JOB,THB,9000,9000,RB11,RB0,RB00,1,BG00020880, HARN ENGINEERING SOLUTIO
12/18/2018,4500143420,50,,ค่าบำรุงรักษา New Fire Pump ส.ค 62,1,JOB,THB,9000,9000,RB11,RB0,RB00,1,BG00020880, HARN ENGINEERING SOLUTIO
12/18/2018,4500143420,60,,ค่าบำรุงรักษา New Fire Pump ต.ค 62,1,JOB,THB,9000,9000,RB11,RB0,RB00,1,BG00020880, HARN ENGINEERING SOLUTIO
12/2/2018,4500142267,10,,"กระติกน้ำร้อนไฟฟ้า""Sharp""#KP-30ST 2.9L",1,SET,THB,821.5,821.5,RB11,RB1,RB00,1,BG00022123, Ek-Chai Distribution Sys
12/6/2018,4500142150,10,,"PTFE Syringe Filter 0.45 um, 13 mm.",12,EA,THB,1000,12000,RB11,RB1,RB00,1,BG00022785," GENIUS SCIENCE CO.,LTD."
12/4/2018,4500141964,10,,ขวดมายองเนส 16 OZ,480,EA,THB,9,4320,RB11,RB2,RB00,1,BG00022799," Yindee 2018 Co.,Ltd."
12/4/2018,4500141964,20,,ขวดมายองเนส 8 OZ,1200,EA,THB,6,7200,RB11,RB2,RB00,1,BG00022799," Yindee 2018 Co.,Ltd."
12/6/2018,4500142456,10,,Maintenance Kit 2000H P/N2901900400,1,SET,THB,9000,9000,RB11,RB0,RB00,1,BG00023159, POOMIPAT ENGINEERING SUP
12/6/2018,4500142456,20,,Screw Guard Rotair P/N 6215714100,2,EA,THB,6800,13600,RB11,RB0,RB00,1,BG00023159, POOMIPAT ENGINEERING SUP
12/20/2018,4500143467,10,,KHUNER PTFE JOINT SEALANT,1,SET,THB,6080,6080,RB11,RB0,RB00,1,BG00023654," BANNA INNOTEC CO.,LTD."
12/3/2018,4500141864,10,,Cookies มะม่วงพานต์ (กป.ใหญ่),40,EA,THB,300,12000,RB11,RB3,RB00,1,BG00024169, COOKIES BY JEAB
12/3/2018,4500141864,20,,Cookies มะม่วงพานต์+ ข้าวโอ๊ต (กป.ใหญ่),60,EA,THB,300,18000,RB11,RB3,RB00,1,BG00024169, COOKIES BY JEAB
12/3/2018,4500141864,30,,Cookies ข้าวโอ๊ตลูกเกด (กป.ใหญ่),32,EA,THB,300,9600,RB11,RB3,RB00,1,BG00024169, COOKIES BY JEAB
12/13/2018,4500142616,10,,Rotary Vane Pump E2M1B 115/220V 50Hz,1,PC,THB,128000,128000,RB11,RB3,RB00,1,BG00024221, Professional Vacuum Part
12/13/2018,4500142616,20,,EMF 20 Oil Mist Filter,1,PC,THB,9500,9500,RB11,RB3,RB00,1,BG00024221, Professional Vacuum Part
12/12/2018,4500143860,10,,"Notebook""Sony""Vaio S/N4219185",1,SET,THB,51257.5,51257.5,RB11,RB3,RB00,1,HRBOJ016  , MR.KAZUTO  USAKA
